<!-- ===================================================================== -->
<!--
 * This file is part of CARDAMOM (R) which is jointly developed by THALES
 * and SELEX-SI. It is derivative work based on PERCO Copyright (C) THALES
 * 2000-2003. All rights reserved.
 * 
 * Copyright (C) THALES 2004-2005. All rights reserved
 * 
 * CARDAMOM is free software; you can redistribute it and/or modify it
 * under the terms of the GNU Library General Public License as published
 * by the Free Software Foundation; either version 2 of the License, or
 * (at your option) any later version.
 * 
 * CARDAMOM is distributed in the hope that it will be useful, but WITHOUT
 * ANY WARRANTY; without even the implied warranty of MERCHANTABILITY or
 * FITNESS FOR A PARTICULAR PURPOSE. See the GNU Library General Public
 * License for more details.
 * 
 * You should have received a copy of the GNU Library General Public
 * License along with CARDAMOM; see the file COPYING. If not, write to the
 * Free Software Foundation, Inc., 675 Mass Ave, Cambridge, MA 02139, USA.
-->
<!-- ===================================================================== -->

<!--DTD specifying parameters for the CDMW fault manager-->
<!ELEMENT groups (object-group*)>

<!ELEMENT object-group (locations, datastoreIDs?)>
<!ATTLIST object-group 
    name CDATA #REQUIRED
	type-id CDATA #REQUIRED
	minimum-number-replicas CDATA #REQUIRED
>
 
<!ELEMENT locations (location*)>
<!ELEMENT location EMPTY>
<!ATTLIST location 
    host-name CDATA #REQUIRED
    application-name CDATA #IMPLIED
    process-name CDATA #REQUIRED
>

<!ELEMENT datastoreIDs (datastoreID*)>
<!ELEMENT datastoreID EMPTY>
<!ATTLIST datastoreID 
    id CDATA #REQUIRED
>
